{
  "id": "h-devops-tools",
  "slug": "devops-tools",
  "code": "H",
  "order": 8,
  "title": { "tr": "DevOps ve Araçlar", "en": "DevOps and Tooling" },
  "description": {
    "tr": "Linux, sunucu yönetimi, Git, Docker, CI/CD, Grafana ve DevOps'ta yapay zekâ: kişisel notlar ve rehberler.",
    "en": "Linux, server management, Git, Docker, CI/CD, Grafana and AI in DevOps: personal notes and guides."
  },
  "icon": "server",
  "color": "#0ea5e9"
}
